{
  "$schema": "../schemas/profile.schema.json",
  "schemaVersion": 1,
  "name": "runtime",
  "description": "All runtime primitives without construction-tool fanout.",
  "selection": ["eson", "esb64", "esarr", "esstr", "eschars", "eshttp", "estimer", "esrand", "esuuid", "esenv", "espath", "esfs", "eshash", "eslog"],
  "scopes": ["runtime"]
}
